,질문,소견
290,"생리끝난지 3일정도후에 남자친구랑 관계를 가졌는데 질내사정은 아니구 바로 뺏다는데 정액이 살짝 들어갔을수도 있다는데 불안해서요 사후피임약을 먹는게 나을까요 임신확률이 클까요? 사후피임약 부작용도 걱정되서요ㅜㅜ그리고 관계가진후 지금 20시간은 아직 안지났어요 
그리고 어제 과음을 해서 속이쓰린데 약을 바로 복용해도 괜찮을까요 ","생리가 끝난 지 3일 후라면 일반적으로 배란일로부터 멀리 떨어져 있을 가능성이 높지만, 개인의 생리주기나 배란시기가 다를 수 있기 때문에 임신 가능성을 완전히 배제할 수는 없어요. 특히 질내사정이 아니었더라도 정액이 살짝 들어갔을 가능성이 있다면 임신의 위험이 있을 수 있어요.

사후피임약은 성관계 후 가능한 빨리 복용할수록 효과가 높으며, 72시간 이내에 복용하는 것이 좋아요. 현재 20시간이 지났다면 아직 사후피임약을 복용할 수 있는 시간적 여유가 있어요. 사후피임약은 처방전이 필요하므로 가까운 병원이나 산부인과를 방문하여 상담을 받으시는 것이 좋아요.

사후피임약의 부작용에 대한 걱정도 이해해요. 사후피임약은 호르몬 변화를 일으켜 부작용을 유발할 수 있으며, 메스꺼움, 구토, 피로감, 생리 불규칙 등의 부작용이 나타날 수 있어요. 과음으로 인해 속이 쓰린 상태에서 약을 복용하면 위장에 부담을 줄 수 있으므로, 약 복용 전에 의사와 상담하여 복용 방법과 시기에 대한 조언을 받으시는 것이 좋아요.

종합적으로, 임신의 위험을 최소화하고자 한다면 사후피임약 복용을 고려해볼 수 있어요. 하지만 부작용과 개인의 건강 상태를 고려하여 의사의 상담을 받는 것이 중요해요. 가능한 빨리 의료 기관을 방문하여 상담을 받으시길 권장드려요."
291,"생리 4,5일차에 질내사정 총 3번했어요 생리 주기는 매달 달라요 한달건너뛸때도있어요 임신 가능성이 있을까요? ","생리 중에 성관계를 가졌을 때 임신 가능성은 일반적으로 낮지만, 완전히 배제할 수는 없습니다. 특히 생리 주기가 불규칙하거나 한 달 건너뛰는 경우가 있다면 배란일을 예측하기 어렵고, 이는 임신 가능성을 더욱 예측하기 어렵게 만듭니다.

생리 4, 5일차에 질내사정이 있었다면, 일반적으로 배란기가 아니라고 가정할 수 있지만, 불규칙한 주기를 가진 경우 배란이 빨리 일어날 수도 있습니다. 또한 정자는 여성의 몸 안에서 최대 5일까지 생존할 수 있으므로, 만약 배란이 성관계 후 곧바로 일어난다면 임신의 가능성이 있습니다.

임신 가능성에 대해 걱정이 되신다면, 가장 확실한 방법은 임신 테스트를 하는 것입니다. 성관계 후 약 2주 후에 임신 테스트를 해보시는 것이 좋습니다. 또한, 임신을 원치 않는 경우라면 사후피임약을 고려할 수 있습니다. 사후피임약은 성관계 후 가능한 빨리, 일반적으로 72시간 이내에 복용하는 것이 가장 효과적이며, 처방전이 필요합니다. 가능한 빨리 산부인과를 방문하여 상담을 받으시길 권장합니다."
292,"4 일전 쯤 침대 누워서 발목을 위 아래로 하는 스트래칭을 좀 과하게 했는지 이후 무터 발목이 불편하더니 아파요 넘어지거나 접지른건 아니에요
걸을때도 아프고 왜그럴까요
아픈 부위가 7 8년전 발목인대수술한 부위라 걱정되네요 ㅠㅠㅠ단순 근육통 염좌 염증일지...","발목을 과하게 스트레칭한 후 불편함과 통증이 발생하는 경우, 여러 가지 원인이 있을 수 있어요. 과도한 스트레칭으로 인해 근육이나 인대에 부담이 가면서 통증이 느껴질 수 있고, 특히 과거에 발목 인대 수술을 받았던 부위라면 더욱 주의가 필요합니다.

스트레칭 후 발생한 통증이 근육통인지, 염좌인지, 염증인지 구분하기 위해서는 몇 가지 점검이 필요해요. 근육통은 일반적으로 근육이 뻐근하고 당기는 느낌이며, 염좌는 인대나 관절 주변에 날카로운 통증이나 부기가 동반될 수 있어요. 염증의 경우, 붉어짐, 열감, 부기 등의 증상이 나타날 수 있어요.

걸을 때 통증이 있다면, 일단은 해당 부위를 휴식하게 하고, 냉찜질을 해주는 것이 좋아요. 또한, 발목을 약간 높이고 쉬어주는 것도 부기를 줄이는 데 도움이 될 수 있어요. 통증이 지속되거나 증상이 악화된다면, 전문의의 진료를 받는 것이 중요해요. 의사는 정확한 진단을 위해 신체 검사, 필요한 경우 영상 진단 등을 시행할 수 있어요.

7-8년 전에 수술한 부위라면, 해당 부위의 구조가 정상보다 약할 수 있으므로, 더욱 조심스럽게 관리하는 것이 중요해요. 만약 통증이 심하거나 부기, 발적 등의 증상이 나타난다면, 가까운 병원이나 정형외과로 내원해 보시면 좋을 것 같아요. :)"
293,아티반 복용후 목근육통이 왔어요,"아티반은 벤조디아제핀 계열의 약물로, 주로 불안 장애나 긴장을 완화하기 위해 처방되는 약입니다. 그러나 이 약물은 근육 이완 효과도 있어서 일부 환자에서는 근육통이나 약화를 유발할 수 있습니다.

아티반 복용 후 목 근육통이 발생했다면, 이는 부작용으로 인한 것일 수 있습니다. 하지만 다른 원인에 의한 것일 수도 있으므로, 목 근육통의 정확한 원인을 파악하기 위해서는 의사와 상담하는 것이 중요합니다. 특히 근육통이 지속되거나 심해지는 경우, 또는 다른 증상이 동반되는 경우에는 즉시 의사의 진료를 받아야 합니다.

의사는 근육통의 원인을 평가하고, 아티반의 복용을 계속할지, 복용량을 조절할지, 아니면 다른 약물로 전환할지 결정할 수 있습니다. 자가 진단이나 자가 치료를 하지 말고 전문가의 조언을 구하는 것이 안전합니다."
294,과거 포경 수술을 받았던 부분에 표피에서 짜면 나오는 피지가 쌓입니다 비뇨기과에서 시술 가능한가요?,"네, 포경 수술 후 피부에 피지가 쌓이는 문제는 비뇨기과에서 시술이 가능합니다. 포경 수술 부위에 피지가 쌓이는 것은 때때로 발생할 수 있는데, 이는 피부의 특정 부위에서 피지선이 막혀서 생기는 현상일 수 있습니다. 비뇨기과 의사는 이러한 문제를 평가하고 적절한 치료 방법을 제안할 수 있습니다. 이는 때로는 약물 치료를 포함할 수도 있고, 필요한 경우 작은 시술을 통해 피지선을 제거하거나 피지를 배출할 수도 있습니다.

의사의 진찰을 받아 정확한 상태를 평가받고, 의사의 권고에 따라 적절한 치료를 받으시는 것이 좋습니다. 비뇨기과 방문 전에 예약을 하시고, 상담 시 과거에 받았던 포경 수술에 대한 정보와 현재 겪고 있는 문제에 대해 자세히 설명하시면 도움이 될 것입니다. 만약 진료 시 문의사항이 있다면 타의료기관에서도 수술에 대한 소견을 물어보셔도 되어요."
295,"소변을 볼때 하얀색 이물질이 떠다닙니다
되게 작은 하얀점처럼 생겼어요
소변볼때 생기는 기포는 아닌거 같은데
제가 먹고 있는 질염치료약이랑 상관이 있을까요?
혹시 요충은 아니겠죠??","소변에 하얀색 이물질이 떠다니는 증상은 다양한 원인에 의해 발생할 수 있습니다. 현재 복용 중인 질염 치료약에 의해 소변의 색이나 탁한 이물감이 동반될 수 있지만, 요충 감염의 경우에도 소변에서 이물질이 나타날 수 있습니다. 그러나 요충 감염은 주로 특정 지역에서 발생하며, 다른 증상들이 동반되는 경우가 일반적입니다.

소변에서 이물질이 발견되는 다른 가능성으로는 요로 감염, 신장 결석, 과도한 칼슘 또는 인 섭취, 탈수, 신장 질환 등이 있을 수 있습니다. 이러한 증상이 지속되거나 다른 증상이 동반되는 경우에는 의사의 진료를 받아 정확한 원인을 파악하고 적절한 치료를 받는 것이 중요합니다.

만약 이 증상이 질염 치료약을 복용한 후에 처음 발생했다면, 약물 부작용의 가능성을 배제할 수 없으므로, 복용 중인 약물의 부작용 정보를 확인하고, 필요하다면 처방해주신 의사에게 상담을 요청하는 것이 좋습니다. 그러나 증상만으로는 정확히 어떤 질환에 해당하는지 확답 드리기 어려워, 증상이 지속되신다면 산부인과 전문의의 진료를 받아보시기를 권유 드려요."
296,"4일전에 남친이랑 갑자기 분위기 타서 진짜 짧게 5초가량 성관계 하다가 콘돔 안 낀 게 생각나 바로 그만뒀는데요, 사정은 안했지만 성관계 하기 몇시간 전에 남친이 사정을 한 적이 있고 저랑 할 땐 쿠퍼액이 좀 흐른 것 같은데 임신 가능성이 있을까요?","성관계 중 콘돔을 착용하지 않고 쿠퍼액이 흘렀다면 임신 가능성을 완전히 배제할 수는 없습니다. 영국 산부인과 학술지 Human Fertility에 실린 연구에 따르면, 쿠퍼액에는 소량의 정자가 포함될 수 있으며, 이 정자들이 여성의 생식기로 들어가 임신을 일으킬 가능성이 있습니다. 특히 성관계 몇 시간 전에 남자친구가 사정을 한 적이 있다면, 요도에 남아있던 정자가 쿠퍼액과 함께 배출될 수 있습니다.

따라서, 임신 가능성을 완전히 배제할 수는 없으므로, 임신을 원하지 않는 경우 사후피임약 복용을 고려해 보시길 안내드려요. 사후피임약은 성관계 후 72시간 이내에 복용하는 것이 가장 효과적이며, 가능한 빨리 복용할수록 임신 방지 효과가 높습니다. 닥터나우 앱 내 '증상 진료' > '사후피임약' > 원하는 의사를 선택하여 충분한 상담 및 복약 지도를 받아보시기를 권유드려요."
297,쇄골 부위에 빨갛고 긁힌 자국이 몇 주간 지속되어 문의합니다. 가려움은 없습니다. 어떤 증상인가요?,"쇄골 부위에 빨갛고 긁힌 자국이 몇 주간 지속되고 있다면, 피부염, 알레르기 반응, 피부 감염 등 다양한 원인이 있을 수 있어요. 가려움증이 없다면, 피부 마찰로 인한 자극, 특정 물질에 대한 접촉성 피부염, 혈관염, 피부 건조증 등을 생각해볼 수 있어요.

하지만 정확한 진단을 위해서는 직접 피부 상태를 보고, 필요한 경우 추가적인 검사를 진행해야 해요. 따라서 지속적으로 증상이 나타나고 있다면 가까운 피부과에 내원하셔서 상담을 받아보시거나 진료를 받아 보시길 권유 드려요. 전문의는 증상을 직접 확인하고, 필요한 경우 피부 스크래치 테스트, 패치 테스트, 혈액 검사 등을 통해 정확한 원인을 찾아 치료 방법을 제안할 수 있어요."
298,비대면 혈압약처방 받을수 있나요 ,"네, 비대면 진료를 통해 혈압약 처방이 가능한 점 안내드려요. 대한민국에서는 코로나19 팬데믹 이후 비대면 진료가 활성화되었고, 일정 조건을 충족하는 경우 온라인으로 의사와 상담 후 처방전을 발급받을 수 있어요. 하지만 처음으로 혈압약을 처방받는 경우나 상태가 심각한 경우에는 직접 병원을 방문하여 진료를 받는 것이 좋습니다. 비대면 진료는 주로 기존에 복용하던 약의 재처방이나 간단한 상담에 더 적합합니다. 비대면 진료를 원하시면, 해당 서비스를 제공하는 병원이나 의료 플랫폼을 통해 예약하시면 됩니다. 다만, 병원이나 약국의 재고 상황 등에 따라 같은 성분의 다른 약으로 대체될 수 있는 점 양해 부탁드려요."
299,소변검사만으로 요로결석이나 신장결석의 유무를 알수있나요?,"소변 검사는 요로결석이나 신장결석을 간접적으로 추정할 수 있는 정보를 제공할 수 있어요. 예를 들어, 소변에서 높은 수준의 칼슘, 요산, 옥살산 등이 발견되면 결석의 가능성을 시사할 수 있어요. 또한, 소변에 혈액이 섞여 있는 경우(혈뇨)도 결석이 있을 때 흔히 볼 수 있는 증상 중 하나입니다.

그러나 소변 검사만으로는 요로결석이나 신장결석의 존재를 확실히 진단하기 어렵다고 알려져 있어요. 결석의 정확한 진단을 위해서는 보통 영상 진단 방법이 필요합니다. 복부 X-선, 초음파, 컴퓨터 단층촬영(CT) 등이 결석의 위치, 크기, 수를 확인하는 데 도움을 줄 수 있어요. 따라서 소변 검사 결과에 이상이 있거나 결석을 의심하는 증상이 있다면, 의사의 정확한 진단을 위해 추가적인 영상 검사를 받는 것이 좋을 것 같아요."
302,"위염식도염으로 약은 먹고 있지만 너무 식욕이 안 땡깁니다
도움이 될만한 방법이 있을까요","위염이나 식도염으로 인한 식욕 감퇴는 불편하실 수 있습니다. 다음과 같은 방법들이 도움이 될 수 있습니다:

1. 소량씩 자주 먹기: 하루에 세 끼 큰 식사 대신에 작은 양을 여러 번에 나누어 먹는 것이 위에 부담을 줄이고 식욕을 조금씩 늘릴 수 있습니다.

2. 음식의 온도와 질감에 주의하기: 너무 뜨겁거나 차가운 음식은 위 점막을 자극할 수 있으므로, 온도가 너무 높거나 낮지 않은 음식을 선택하고, 부드럽고 잘 씹히는 음식을 섭취하는 것이 좋습니다.

3. 피해야 할 음식 피하기: 카페인, 알코올, 지방이 많은 음식, 매운 음식, 튀긴 음식 등은 위 점막을 자극할 수 있으므로 가능한 한 피하는 것이 좋습니다.

4. 충분한 수분 섭취: 탈수는 식욕 감퇴를 더욱 악화시킬 수 있으므로, 충분한 수분을 섭취하는 것이 중요합니다. 물이나 허브차 등을 자주 마시는 것이 좋습니다.

5. 스트레스 관리: 스트레스는 위장 질환을 악화시킬 수 있으므로, 요가, 명상, 규칙적인 운동 등을 통해 스트레스를 관리하는 것이 도움이 될 수 있습니다.

6. 영양 보충제 고려: 식욕이 없을 때는 필요한 영양소를 섭취하기 어려울 수 있으므로, 의사와 상담하여 영양 보충제를 고려해 볼 수 있습니다.

7. 의사와 상담: 현재 복용 중인 약물이 식욕 감퇴를 유발할 수도 있으므로, 의사와 상담하여 약물 조절이 필요한지 확인해 보세요.

식욕이 없을 때는 강제로 음식을 먹기보다는 위에 부담을 주지 않는 방법으로 조금씩 섭취하는 것이 중요합니다. 지속적으로 식욕이 없거나 다른 증상이 동반되는 경우에는 의사와 상담하여 추가적인 조치를 취하는 것이 좋습니다. 그리고 식욕부진의 원인을 먼저 파악하는 것이 중요할 것으로 생각되어 소화기내과에 내원하여 해당 증상에 대해 진료를 받아보시는게 좋겠어요:)"
303,혈압약처방 받고싶습니다 ,"혈압약의 처방은 가능한점 안내드려요! 하지만 처방 권한은 의사에게 있으므로 기존에 복용하던 약이 있을 때는 진료 요청 시 처방전 사진을 첨부하거나 자세히 말씀해 주시면 처방에 참고가 될 수 있어요. 다만, 병원이나 약국의 재고 상황 등에 따라 같은 성분의 다른 약으로 대체될 수 있는 점 양해 부탁드려요. 만약, 기존 복용하던 약이 없이 혈압약을 요청 주시는 거라면 정확한 진단을 위해 의료기관에 방문해서 처방을 받아야하는 대면진료가 필요할 수 있어요. 혈압이 높지만 처음 약을 복용하시는 경우 가능하다면 대면진료를 먼저 받아보시길 권유드려요. 혈압약의 종류도 다양하기 때문에 병원에서 정확한 혈압 수치를 확인 후 적절한 약물 처방이 필요해요."
304,금연후 맥박이 서맥수준으로 많이줄었는데 이거 문제있는거 아닌가요? 금연전 안정시 62회 전후였던 맥박이 금연후 53회 전후로 줄었습니다. ,"금연 후 맥박이 줄어드는 현상은 흡연이 심장에 미치는 자극적인 영향이 사라지면서 나타날 수 있는 자연스러운 반응일 수 있어요. 흡연은 심박수를 증가시키는데, 금연으로 인해 심장이 더 효율적으로 작동하게 되면서 안정 시 맥박이 낮아질 수 있어요.

안정 시 맥박이 60회 미만으로 떨어지는 것을 '서맥(bradycardia)'이라고 합니다. 하지만 맥박이 50회대인 경우, 특히 운동을 자주 하는 사람이나 건강한 개인에서는 정상적인 현상일 수도 있어요. 서맥 자체가 반드시 문제가 되는 것은 아니며, 증상이 없고 일상생활에 지장이 없다면 특별한 치료가 필요하지 않을 수 있어요.

그러나 맥박이 갑자기 많이 줄어들었고, 이와 함께 어지럼증, 피로감, 호흡곤란, 가슴 통증 등의 증상이 동반된다면, 심장 질환을 포함한 다른 건강 문제가 있을 수 있으므로 의료기관 진료를 받는 것이 좋아요.

금연 후 맥박 변화에 대해 걱정이 되신다면, 정확한 평가를 위해 가까운 병원이나 클리닉을 방문하여 심전도 검사(EKG)나 기타 필요한 검사를 받아보시는 것을 권장합니다. 의사는 여러분의 전반적인 건강 상태와 증상을 종합적으로 평가하여 필요한 조치를 안내해 드릴 것입니다."
305,방광염 증상에 뭔가요?,"방광염은 세균이 침입하여 발생한 감염으로 인해 방광에 염증이 생기는 질환입니다. 방광염의 증상은 다음과 같습니다:

1. 빈뇨: 소량의 소변을 자주 보게 됩니다.
2. 절박뇨: 갑작스럽게 소변을 매우 급하게 느끼는 경우가 있습니다.
3. 배뇨 시 통증 또는 찌릿한 느낌: 소변을 볼 때 통증이나 타는 듯한 느낌이 있을 수 있습니다.
4. 혈뇨: 소변에 피가 섞여 나오는 경우가 있습니다. 이는 부정출혈로 오인될 가능성이 있습니다.
5. 하부 허리 통증: 방광 주위에 통증이 느껴질 수 있습니다.
6. 혼탁뇨: 소변이 평소보다 뿌옇게 보일 수 있습니다.
7. 소변에서 나쁜 냄새: 소변에서 나쁜 냄새가 날 수 있습니다.

이러한 증상이 나타나면 가까운 비뇨의학과에 내원하여 검사 및 진료를 통해 적절히 치료하실 것을 권장드립니다. 또한, 앱 내 의료진의 진료를 받고 알맞은 약을 처방 받아 보시기를 추천드립니다. 방광염의 경우 적절한 시기에 항생제를 사용하면 호전이 될 수 있습니다."
307,소화기내과 의료진과 상담받은 19살 여학생입니다!위내시경과 항생제 약에 대해 상담을 했는데 부작용 등등 문제가 있을수 있어서 성인때 하고 지금 약 처방으로 하기로 했습니다! 제가 성인되면 친구들과 술을 먹을 수 있잖아요. 술을 가끔씩이나 조금씩은 먹어도 될까요? 식습관을 꾸준히 관리하면서요 ㅠㅠ,"위내시경 검사와 항생제 치료를 받고 계신 19살 여학생이시군요. 술은 소화기계에 자극을 줄 수 있으며, 특히 위장 관련 질환을 가지고 계신 분들에게는 더욱 조심해야 합니다. 또한, 항생제와 술은 상호작용을 일으킬 수 있어서 복용 중에는 피해야 합니다.

성인이 되셨을 때 술을 마시는 것에 대해 말씀드리자면, 개인의 건강 상태와 술에 대한 내성, 그리고 술을 마시는 양과 빈도에 따라 다를 수 있습니다. 만약 위장 질환이 완전히 호전되었고, 의료진의 상담을 통해 건강이 술을 마시기에 적합하다는 판단을 받으셨다면, 가끔씩 적당량을 섭취하는 것은 가능할 수 있습니다. 하지만, 다음 사항들을 고려해야 합니다:

1. 술을 마시기 전에 반드시 담당 의료진과 상담하여 건강 상태와 약물 복용 여부를 확인하세요.
2. 술을 마실 때는 절제를 하고, 과음을 피하세요.
3. 술을 마신 후에는 충분한 수분 섭취와 함께 휴식을 취하세요.
4. 식습관 관리는 중요하며, 술을 마실 때에도 건강에 해가 되지 않는 음식을 선택하세요.

건강을 최우선으로 생각하시고, 의료진의 조언을 따르는 것이 중요합니다. 만약 술을 마시고 싶으시다면, 위의 사항들을 염두에 두시고 신중하게 결정하시기 바랍니다."
308,성호로몬이 과도하게만 안 나오면 성장에 도움을 줄 수 있다는 데 사실인가요,"성장호르몬은 성장과 밀접한 관련이 있으며, 적절한 수준으로 분비되어야 정상적인 성장이 이루어집니다. 성장호르몬이 과도하게 분비되면 거대증이나 성조숙증과 같은 문제를 일으킬 수 있고, 반대로 부족하게 분비되면 성장 지연이나 성장호르몬 결핍증을 초래할 수 있습니다.

성장호르몬이 과도하게만 분비되지 않는다고 해서 반드시 성장에 도움이 되는 것은 아닙니다. 성장에는 성장호르몬뿐만 아니라 유전, 영양 상태, 운동, 수면 등 다양한 요소가 영향을 미칩니다. 따라서 성장호르몬의 적절한 분비뿐만 아니라 이러한 다른 요소들도 함께 고려되어야 합니다.

성장에 문제가 있다고 생각되면 가까운 성장클리닉 등을 가셔서 의사와 상의해보시길 바래요. 전문의는 환자의 성장 패턴, 호르몬 수치, 그리고 다른 건강 상태를 종합적으로 평가하여 필요한 조치를 취할 것입니다."
309,성 호로몬이 많이 나와서 키가 안 자랄 수 있자나요 그러면 혹시 사춘기 전에도 닫힐 수 있나요,"성장을 마무리하는 역할을 하는 성 호르몬인 에스트로겐과 테스토스테론은 성장판의 성숙과 닫힘을 촉진할 수 있어요. 사춘기가 시작되면 이 호르몬들의 분비가 증가하면서 성장판이 점차 닫히게 되고, 이로 인해 성장이 느려지거나 멈출 수 있어요.

사춘기 전에도 성 호르몬이 과도하게 분비되는 경우가 있는데, 이를 조발성 사춘기라고 해요. 조발성 사춘기는 정상적인 사춘기가 시작되는 나이보다 훨씬 일찍 성 호르몬이 분비되어 성적인 특징이 나타나고 성장판이 닫히게 되는 상태를 말해요. 이 경우에는 성장판이 일찍 닫혀 키 성장이 조기에 멈출 수 있어요.

조발성 사춘기는 여러 가지 원인에 의해 발생할 수 있으며, 이를 정확히 진단하고 적절한 치료를 받는 것이 중요해요. 만약 조발성 사춘기가 의심되는 경우에는 소아 내분비 전문의와 상담하여 호르몬 검사, 뼈 나이 검사 등을 통해 평가를 받아야 해요. 그리고 성장판이 닫히는 시기는 개인마다 다를 수 있지만, 일반적으로 여자는 14~16세, 남자는 16~18세 쯤에 성장판이 닫히게 된다고 해요."
310,뇌mri+mra를 찍어보면 지나간 미니뇌졸중(tia)도 발견할수 있나요??,"뇌 MRI는 뇌의 상세한 이미지를 제공하고, MRA는 뇌혈관의 이미지를 제공합니다. 미니뇌졸중(TIA, 일과성 뇌허혈 발작)은 일시적으로 뇌혈류가 감소하여 일시적인 신경학적 결함을 일으키는 상태입니다. TIA는 증상이 몇 분에서 24시간 이내에 완전히 사라지기 때문에, MRI나 MRA로 직접적인 증거를 찾기 어려울 수 있습니다.

그러나 뇌 MRI는 TIA 후에 발생할 수 있는 미세한 뇌 손상이나 이전에 발생했던 작은 뇌졸중의 흔적을 발견하는 데 도움이 될 수 있습니다. 또한 MRA는 TIA의 원인이 될 수 있는 혈관의 이상을 평가하는 데 유용합니다. 예를 들어, 혈관이 좁아지거나 막힌 부분을 확인할 수 있습니다.

따라서 뇌 MRI와 MRA는 TIA의 진단에 직접적으로 사용되지는 않지만, TIA의 원인을 찾고, 뇌졸중의 위험을 평가하는 데 중요한 정보를 제공할 수 있습니다. TIA가 의심되는 경우, 신속한 의료 평가를 받는 것이 중요하며, 필요한 경우 뇌 MRI나 MRA를 포함한 다양한 검사를 시행할 수 있습니다. 또한, 뇌졸중 전조 증상이 있으신 경우라면 빨리 치료를 시작 할 수록 회복 가능성이 높아 지기 때문에 의심해 되는 증상이 있다면, 가능한 빨리 의료진의 정확한 진료를 받아 보시는 것이 좋을 것으로 보여져요."
