,질문,소견
141,왼쪽귀가 먹먹해서 검사를 받았는데 왼쪽 귀 청력이 오른쪽에 비해 살짝 낮다고 진단을 받았습니다. 그래서 치료를 위해 스테로이드를 복용중인데 이제는 오른쪽 귀가 불편한데 감기로 인해 일시적으로 불편한 증세를 보일 수 있나요?,"왼쪽 귀의 청력 저하로 스테로이드를 복용 중이시고, 이제 오른쪽 귀에 불편함을 느끼시는군요. 오른쪽 귀의 불편함이 감기로 인한 것인지 여부는 여러 가지 요소를 고려해야 합니다. 감기는 중이염이나 유스타키오 관의 기능 장애를 일으킬 수 있으며, 이로 인해 귀에 불편함이나 압력감, 청력 저하 등이 발생할 수 있습니다.

그러나 오른쪽 귀의 불편함이 감기 증상인지 아니면 다른 원인에 의한 것인지 정확히 알기 위해서는 몇 가지 추가적인 정보가 필요합니다. 예를 들어, 감기와 관련된 다른 증상들(코막힘, 인후통, 기침, 발열 등)이 있는지, 귀의 불편함이 갑작스럽게 시작되었는지, 청력 변화가 있는지 등을 고려해야 합니다.

만약 감기 증상이 있고, 귀의 불편함이 최근에 발생했다면 감기로 인한 일시적인 증상일 가능성이 있습니다. 하지만 귀의 불편함이 지속되거나 청력에 변화가 있다면, 이비인후과 전문의와 상담하여 정확한 진단과 적절한 치료를 받으시는 것이 중요합니다.

스테로이드 복용 중에는 면역 체계에 영향을 줄 수 있으므로, 감염에 더 취약해질 수 있습니다. 따라서 증상이 지속되거나 악화된다면 의료 전문가의 조언을 구하는 것이 안전합니다."
142,약 먹고 변색이 약간 회색? 계열이던데 약때문일까요? 사진첨부합니다,"약물 복용 후 변색이 발생하는 경우, 그 원인은 해당 약물의 부작용일 수도 있고, 다른 건강 문제의 신호일 수도 있어요. 특히 변이 회색 계열로 변색되는 것은 일반적이지 않으며, 간 기능 장애나 담도 문제와 같은 건강상의 문제를 나타낼 수 있어요. 그러나 인터넷 상에서 사진을 보고 정확한 진단을 내리는 것은 어려워요.

변의 색깔 변화가 지속되거나 다른 증상이 동반되는 경우, 반드시 의사의 진료를 받아야 해요. 의사는 복용 중인 약물, 증상의 지속 기간, 그리고 다른 관련 증상들을 종합적으로 고려하여 정확한 원인을 파악하고 적절한 조치를 취할 수 있어요.

가능하다면, 약물 복용을 시작하기 전과 후의 변화를 주의 깊게 관찰하고, 복용 중인 약물의 이름과 용량, 복용 기간 등을 기록해 두시는 것이 좋아요. 이 정보는 의사가 상황을 평가하는 데 도움이 될 것입니다.

즉시 가까운 의료 기관을 방문하거나 전문가와 상담하여 건강 상태를 확인하시기 바랍니다."
143,"질염일 땐 무슨 연고를 발라야 좋을까요?
그리고 성병이 걸렸을 땐 무슨 연고를 발라야 좋을까요?","질염이나 성병의 경우, 적절한 치료를 위해서는 먼저 의사의 진단이 필요합니다. 질염의 경우, 효모 감염일 때는 국소용 항진균제 연고나 질정이 처방될 수 있고, 세균성 질염일 경우에는 항생제 치료가 필요합니다. 트리코모나스 질염의 경우에는 항원충제가 필요할 수 있습니다.

성병의 경우, 예를 들어 클라미디아나 임질과 같은 성병은 항생제 치료가 필요하며, 이는 주로 경구용 항생제로 치료됩니다. 헤르페스의 경우에는 항바이러스제 연고가 사용될 수 있습니다.

어떤 경우든, 자가 진단이나 자가 치료를 하기보다는 증상이 있을 때는 성병 전문 클리닉이나 산부인과를 방문하여 정확한 진단을 받고, 의사의 처방에 따라 적절한 치료를 받는 것이 중요합니다. 질염이나 성병은 적절한 치료를 받지 않을 경우 합병증을 유발할 수 있으므로, 전문가의 도움을 받는 것이 안전합니다. 또한, 질염의 빠른 치유를 위해 꽉 끼는 하의의 착용을 피하고, 성관계 후에는 반드시 소변을 보아서 방광을 비워내고, 소변을 본 다음에는 항상 앞에서 뒷쪽으로(요도 입구에서 항문 쪽으로) 닦아내주는 등의 생활 습관 개선도 함께 해주세요."
145,아침에 밥먹다가 토했고 공복으로 있었더니 지금은 괜찮아졌어요. 토마토나 배 먹어도 되나요??,"토한 후에는 위장이 예민해져 있을 수 있으므로 소화가 잘 되는 음식을 섭취하는 것이 좋습니다. 토마토는 산성이 강하고 섬유질이 많아서 위장에 부담을 줄 수 있습니다. 반면에 배는 수분이 많고 부드러우며 소화가 잘 되는 과일로, 위장이 약한 상태에서 섭취하기에 비교적 좋은 선택입니다. 따라서 토마토보다는 배를 드시는 것을 추천드립니다. 그러나 소량으로 시작하여 위장의 반응을 살피면서 조금씩 섭취량을 늘려가는 것이 좋습니다. 만약 불편함이 지속되거나 다시 구토 증상이 나타난다면 의사의 진료를 받으시는 것이 좋겠습니다. 그리고 위에 부담이 가지 않는 선에서 식사를 해주시면 좋을 것으로 보여져요 :) 맵고 짜고 기름진 음식은 피해주시고 죽이나, 국물이 있는 음식을 드셔 주시는 것이 좋을 것으로 보여져요."
167,낮잠만 자고 일어나면 꼭 여드름이 생기던데 원래 다들 이런 건가요? 그날 저녁에 세수하려고 거울 보면 흰 여드름이 올라와 있어요,"낮잠을 자고 일어났을 때 여드름이 생기는 것은 모든 사람에게 흔한 현상은 아닙니다. 그러나 몇 가지 가능한 원인이 있을 수 있습니다.

1. 베개나 침구류가 깨끗하지 않아 피부에 자극을 주거나 세균이 번식할 수 있습니다. 정기적으로 베개 커버와 침구류를 세탁하는 것이 중요합니다.

2. 낮잠 동안 피부에 땀이나 기름이 많이 분비되어 모공이 막힐 수 있습니다. 이는 특히 기름진 피부 타입을 가진 사람에게 더 자주 발생할 수 있습니다.

3. 스트레스나 호르몬 변화도 여드름 발생에 영향을 줄 수 있습니다. 낮잠을 자는 것이 스트레스 해소에 도움이 되지만, 반대로 스트레스가 여드름을 유발할 수도 있습니다.

4. 낮잠을 자기 전에 화장을 지우지 않거나 피부를 깨끗이 하지 않는 경우에도 여드름이 생길 수 있습니다.

여드름을 예방하기 위해서는 낮잠을 자기 전후로 피부를 깨끗이 하는 것이 좋습니다. 또한, 정기적으로 베개 커버와 침구류를 세탁하고, 피부 타입에 맞는 스킨케어 제품을 사용하는 것이 도움이 될 수 있습니다. 만약 여드름이 자주 발생하거나 심각한 경우에는 피부과 전문의와 상담하는 것이 좋습니다. 피부과 전문의와 상담을 통해 피지조절제 등에 대해 상담하실 것을 권유드려요."
168,여자인데 심장뼈가 아프면 무슨 병원에 가야하나요?,"심장뼈가 아프다고 느끼시면, 일반적으로 내과를 방문하시는 것이 좋습니다. 내과에서는 가슴 통증의 원인을 평가하고 필요한 경우 심전도(EKG), 혈액 검사, 흉부 X-레이 등의 검사를 시행하여 심장 문제인지 아니면 다른 원인(예: 근골격계 문제, 위장계 문제 등)에 의한 것인지를 평가할 수 있습니다.

만약 가슴 통증이 심하고, 호흡곤란, 식은땀, 구토, 심한 압박감 등의 증상이 동반되는 경우에는 심장질환의 가능성이 있으므로 즉시 응급실을 방문하셔야 합니다. 여성의 경우 심장질환의 증상이 남성과 다를 수 있으므로 증상을 가볍게 여기지 마시고, 필요한 경우 즉각적인 의료 조치를 받으시는 것이 중요합니다.

그러나, 심장뼈 통증이 근육통이나 늑연골염, 늑간 신경통 등의 가능성도 있으므로, 통증의학과나 정형외과 등에도 방문하여 진료를 받아 보시는 것이 도움이 될 수 있습니다."
169,뇌진탕 후 목 어깨의 뻣뻣한 증상이 가슴에 통증도 유발할 수 있나요? ,"뇌진탕 후에 목과 어깨의 뻣뻣함과 같은 증상이 나타날 수 있으며, 이러한 증상이 가슴 통증을 유발할 수도 있습니다. 뇌진탕은 머리에 충격을 받아 발생하는 경미한 뇌 손상으로, 다양한 신체적, 인지적, 정서적 증상을 유발할 수 있습니다. 목과 어깨의 긴장이나 뻣뻣함은 뇌진탕으로 인한 근육 긴장의 결과일 수 있으며, 이는 가슴 근육에도 영향을 미쳐 통증을 일으킬 수 있습니다.

그러나 가슴 통증은 다른 심각한 상태의 징후일 수도 있으므로, 특히 뇌진탕 후에 새로운 증상이 나타나는 경우에는 반드시 의료 전문가의 진료를 받아야 합니다. 가슴 통증이 심장 문제나 다른 중요한 건강 문제와 관련이 있을 수 있기 때문에, 증상을 무시하지 말고 적절한 진단과 치료를 받는 것이 중요합니다. 이러한 증상이 나타나면 이비인후과, 신경외과, 순환기내과, 흉부외과, 심장내과 등에서 진료를 받아보시는 것이 좋을 것 같습니다."
171,"현재 혈압약 복용중 의사 선생님께서 혈압이 현재 복용중인 혈압약 (세비카정 5/20)에서 (노바스크정 2.5) 으로 의사선생님께서 바뀌서 처방해주었는데 괜찮을까요~?
약 바꾸고 부작용은 없을까요 ~?","세비카정(5/20)에서 노바스크정(2.5)으로 혈압약을 변경하는 것은 의사 선생님이 환자의 혈압 상태, 건강 상태, 약물 반응 등을 고려하여 결정한 것일 것입니다. 세비카정은 암로디핀과 올메사르탄을 함유한 복합제이며, 노바스크정은 암로디핀 단일 성분의 약물입니다.

약물 변경 시 부작용에 대한 우려는 자연스러운 것이나, 일반적으로 약물 변경은 환자의 혈압 조절에 더 효과적이거나 부작용을 줄이기 위해 이루어집니다. 노바스크정은 일반적으로 잘 견디는 약물이지만, 개인에 따라 부작용이 나타날 수 있습니다. 암로디핀의 흔한 부작용으로는 발목 부종, 얼굴 홍조, 두통, 피로감 등이 있을 수 있습니다.

약물을 변경한 후에는 새로운 약물에 대한 몸의 반응을 주의 깊게 관찰하시고, 이상 증상이 나타나면 즉시 의사 선생님께 알리는 것이 중요합니다. 또한, 혈압을 정기적으로 측정하여 약물이 혈압을 효과적으로 조절하고 있는지 확인하는 것도 필요합니다.

약물 변경에 대한 걱정이나 부작용에 대한 우려가 있으시다면, 처방해주신 의사 선생님과 상의하여 자세한 설명을 듣고, 필요한 경우 관리 방법에 대해 조언을 구하는 것이 좋습니다."
176,"운동하거나 일할때 땀을 흠뻑 흘리고 나서 땀 식으면 머리가 띵하거나 쓰러질듯 어지럼증 오는데요
또한 운동후 고개숙여 엎드렸다 일어나도 어지럼증 발생학니다
샤워하고 나서도 그러구요
식사직후에도 두통과 어지럼증 발생하는데요
혈압과 관련이 있나요~?
이모든게 혹시 혈압이 낮아서 그러는건가요~? 높아서 그러는 건가요~?
현재 혈압약 복용중입니다.
복용한지는 거의 4년째이구요~","운동 후나 식사 후 어지럼증이 발생하는 것은 다양한 원인이 있을 수 있습니다. 혈압과 관련된 문제일 수도 있고, 탈수, 저혈당, 빈혈 등 다른 건강 문제일 수도 있습니다.

혈압약을 복용하고 계시다면, 혈압이 너무 낮아지거나 높아지는 것과 관련이 있을 수 있습니다. 운동 후에는 심장이 더 많은 혈액을 펌프질하여 혈압이 일시적으로 상승할 수 있고, 땀을 많이 흘리면 체액이 감소하여 혈압이 떨어질 수 있습니다. 또한, 식사 후에는 소화를 위해 혈액이 위장으로 몰리면서 일시적으로 혈압이 낮아질 수 있는 현상인 식후 저혈압이 발생할 수 있습니다.

어지럼증이 자주 발생하고, 특히 운동이나 식사 후에 더 심해진다면, 혈압을 정기적으로 측정하고, 혈압약의 용량이나 종류가 적절한지 의사와 상의하는 것이 중요합니다. 또한, 충분한 수분 섭취와 균형 잡힌 식사를 하는 것도 중요합니다.

현재 증상을 바탕으로 정확한 진단을 내리기 위해서는 직접 의사의 진료를 받아보시는 것이 좋습니다. 의사는 혈압 측정, 혈액 검사, 심전도 검사 등을 통해 정확한 원인을 파악하고 적절한 조치를 취할 수 있습니다."
177,다리에 힘이 하나도 안 들어가고 허리랑 목은 아프고 뻐근란 느낌 들고 걸을 때마다 다리가 부들거려요 알아보니 척추관 협착증이랑 증상 비슷하구요 근데 정형외과 가니 뼈에는 문제 없다고 하는데 계단 오르는 거도 힘들고 엉덩이가 무거운 느낌이 드는데 척추관 협착증일까요 손발이 저려요 그럼 신경 외과를 가야하나요? 머리도 아픕니다,"척추관 협착증은 척추관이 좁아져 신경을 압박하여 다리와 허리 통증, 다리에 힘이 빠지는 증상, 걸을 때 다리가 부들거리는 증상, 엉덩이에 무거운 느낌 등을 유발할 수 있어요. 손발의 저림과 머리 통증도 신경학적 문제와 관련이 있을 수 있어요.

정형외과에서 뼈에 문제가 없다고 하셨지만, 척추관 협착증은 단순히 뼈의 문제가 아니라 신경 압박으로 인한 증상이기 때문에 추가적인 검사가 필요할 수 있어요. MRI와 같은 영상 진단을 통해 척추관의 협착 여부를 확인할 수 있어요.

신경학적 증상이 있으시므로 신경 외과를 방문하시는 것이 좋겠어요. 신경 외과에서는 보다 전문적인 신경계 진단과 치료를 받으실 수 있어요. 또한, 머리 통증의 원인도 함께 평가받을 수 있어요.

증상이 지속되거나 악화되는 경우에는 빠른 시일 내에 신경 외과 전문의와 상담하시어 정확한 진단과 적절한 치료를 받아 보시길 권유 드려요."
178,갑자기 감기증상이 있고 콧물이 초록색이길래 찾아버니 축농증이리고 하더라고요 증상이 열나고 피곤하고 코 위쪽에 콧물이 차있는 듯한 느낌이에요 이미 병원에서 감기약을 처방받았는데 축농증 약으로 다시 처방받아야할까요? 그냥 감기약만 먹어도 나을까요?,"축농증은 부비동염이라고도 하며, 코 주변의 부비동에 염증이 생기는 질환입니다. 감기로 인해 발생할 수도 있지만, 감기와는 다른 치료가 필요할 수 있습니다. 초록색 콧물, 열, 피로감, 코 위쪽의 불편함 등은 축농증의 증상일 수 있습니다.

감기약은 주로 증상을 완화시키는 데 도움을 주지만, 축농증의 경우 항생제나 스테로이드 코 스프레이와 같은 추가적인 치료가 필요할 수 있습니다. 따라서 이미 처방받은 감기약만으로 증상이 호전되지 않거나, 증상이 심해지는 경우에는 의사의 진료를 받아 축농증에 적합한 치료를 받는 것이 좋습니다.

증상이 지속되거나 악화된다면, 다시 병원을 방문하여 축농증에 대한 정확한 진단과 적합한 치료를 받으시는 것을 권장합니다. 의사는 증상과 상태를 평가한 후 필요한 경우 항생제 처방을 포함한 축농증 치료를 시작할 수 있습니다. 그러나 약의 복용과 중단 결정은 약을 처방한 의료진과 상의해 주세요."
180,"4개월차 아기 손으로 집는걸 하지않아요.
딸랑이든 치발기든 장난감이든 인형이든 손에 쥐어주면 놔버리고 입우로 가져가지도 않고 자기손도 입에 넣어줘도 좀만지나 빼버리고 쪽쪽이도 많이 삘지읺고 빼버려요.
손가락울 쥐어주면 힘주고 잡기도 하는데 물건들은 절대 안잡으려하는데 뭐가 문제일까요?
타이니 모빌도 관심없고 아무것도 관심없어서 자폐성향인가 하는 걱정이 되어 무서워서 이것저것 쥐어주고 하는데도 전혀 안되는 걱정이 되는데 대학병원가서 유전자 검사를 받아봐야좋을까요?
발달도 느린데 빨리 재활울 시작해주면 관심도 생길까요,,,?","아기의 발달에 대해 걱정이 많으시군요. 아기마다 발달 속도에는 차이가 있어요. 일부 아기들은 다른 아기들보다 느리게 발달할 수 있습니다. 그러나 아기의 발달이 느리다고 느껴지거나 특정 발달 과정에 문제가 있다고 생각되면 전문가의 평가를 받는 것이 좋습니다.

유전자 검사는 특정한 유전적 조건이나 질환을 확인하기 위해 실시될 수 있으며, 아기의 발달 지연이나 다른 건강 문제와 관련이 있을 수 있는 경우에 유용할 수 있습니다. 그러나 유전자 검사는 모든 경우에 필요한 것은 아니며, 전문가의 평가와 상담을 통해 검사의 필요성을 결정하는 것이 중요합니다.

대학병원이나 소아발달 클리닉에서 소아과 전문의나 발달전문가의 상담을 받아보시는 것을 추천드립니다. 전문가는 아기의 발달 상태를 평가하고, 필요한 경우 추가적인 검사나 치료를 권장할 수 있습니다. 또한, 조기에 적절한 재활이나 치료를 시작하는 것이 아기의 발달에 도움이 될 수 있으므로, 전문가의 조언을 구하는 것이 좋습니다.

자폐 스펙트럼 장애(ASD)에 대한 걱정도 있으시다면, 이 역시 전문가의 평가를 통해 확인할 수 있습니다. 자폐 스펙트럼 장애는 일반적으로 아기가 더 많은 발달 단계를 거친 후에 진단이 이루어지기 때문에, 4개월 아기에게는 조금 이른 감이 있지만, 전문가의 조기 평가는 중요한 정보를 제공할 수 있습니다.

결론적으로, 아기의 발달에 대한 걱정이 있으시다면 대학병원이나 소아발달 클리닉에서 전문가의 상담을 받아보시는 것이 좋겠습니다. 전문가의 평가를 통해 아기의 발달 상태를 정확히 파악하고, 필요한 경우 유전자 검사를 포함한 추가적인 검사나 조기 재활을 시작할 수 있을 것입니다."
181,"병원에서 인후염, 편도염, 비염 진단 받았는데 결막염처럼 찐득한 눈꼽이 계속 생겨서 자고 일어나면 눈이 잘 안 떠져요. 이거 괜찮은건가요?","인후염, 편도염, 비염 등의 상기도 감염은 때때로 눈의 결막에 염증을 일으키는 결막염을 동반할 수 있어요. 찐득한 눈꼽이 생기고 눈이 잘 안 떠지는 증상은 결막염의 일반적인 증상 중 하나로 볼 수 있어요.

그러나 이러한 증상이 지속된다면, 추가적인 치료가 필요할 수 있으므로 가까운 안과에 내원하여 검사 및 진료를 받아보실 것을 권유드려요. 안과 전문의는 적절한 검사를 통해 결막염의 원인을 파악하고, 필요한 경우 항생제 안약이나 스테로이드 안약 등의 처방을 할 수 있어요.

눈꼽이 생기는 동안에는 손으로 눈을 비비지 않도록 주의하고, 깨끗한 물이나 생리식염수로 눈 주변을 깨끗이 닦아주는 것이 좋아요. 또한 개인 위생을 철저히 하여 감염의 확산을 방지하는 것이 중요해요.

증상이 심하거나 개선되지 않는 경우, 빠른 시일 내에 안과 진료를 받으시길 권장드려요."
184,비문증은 약물로 치료되나요? 안경과 렌즈없이,"비문증은 노화, 알수없는 원인으로 후유리체박리에 의해 눈앞에 실, 점, 먼지나 벌레 같은 것들이 떠다니는 것처럼 느끼는 증상입니다. 비문증의 약물 치료 가능 여부는 비문증의 유형과 원인, 그리고 환자의 나이와 상태에 따라 다를 수 있습니다.

일반적으로 비문증의 경우 한번 생기면 지속되는 경우가 많고, 일상생활에서 크게 문제가 없다면 수술 혹은 레이저 시술과 같은 수술적 치료는 하지 않는다고 합니다. 또한, 비문증을 해결할 수 있는 가장 좋은 방법은 눈에 떠다니는 물체를 무시하는 방법이라고 하며, 떠다니는 물체의 수나 크기가 증가하거나, 일상생활에서 느끼는 고통이 큰 경우 수술적 치료가 고려 될 수 있습니다.

약물 치료에 대한 질문에 대해 답변드리자면, 비문증의 경우 일반적으로 약물 치료가 효과적이지 않다고 알려져 있습니다. 하지만, 이는 개인의 상태와 증상에 따라 다를 수 있으므로, 보다 정확한 것은 안과에 내원하셔서 대면진료를 받아보시는 걸 권유드립니다."
185,내일 비문증때문에 안과에 가려고하는데 비문증 치료를 약물로도 받나요? 받으면 이비인후과에서 감기때문에 약을 처방 받았는데 같이 먹어도될까요 저희 엄마는 다른 진료과목이라 상관없다고 하시건데,"비문증 치료는 원인과 증상의 정도에 따라 다양한 방법이 있습니다. 가벼운 경우에는 안경이나 렌즈로 교정이 가능하며, 심한 경우에는 수술적 치료가 필요할 수 있습니다. 약물 치료는 주로 동반된 눈의 염증이나 다른 증상을 완화하기 위해 사용될 수 있습니다.

이비인후과에서 처방받은 감기약과 비문증 치료를 위한 약물을 병용하는 것이 가능한지는 처방받은 약물의 종류에 따라 다릅니다. 대부분의 경우, 감기약과 비문증 치료 약물 간에 중대한 상호작용은 없지만, 안전을 위해 내일 안과 진료 시 의사에게 이비인후과에서 처방받은 약물에 대해 꼭 알리시고 상담을 받으시는 것이 좋습니다. 의사는 처방받은 약물의 성분을 확인하고, 비문증 치료에 영향을 줄 수 있는지 여부를 판단하여 안내해 줄 것입니다.

엄마의 말씀처럼 다른 진료과목의 약이라고 해서 반드시 상관이 없는 것은 아니므로, 전문의의 조언을 구하는 것이 가장 안전합니다. 이전 질문에서도 언급했듯이, 병원 의료진의 처방에 따라 치료를 진행해 주시는 게 좋을 것 같아요."
187,갑자기 오른쪽 다리가 오늘 하루종일 욱신욱신거려요. 왜그럴까요,"오른쪽 다리가 욱신거리는 원인은 다양할 수 있습니다. 가장 흔한 원인으로는 근육통, 피로 누적, 잘못된 자세, 운동 부족, 혹은 과도한 운동으로 인한 근육의 긴장이나 손상 등이 있습니다. 또한 정맥의 문제, 신경 압박, 혈액 순환 장애, 염증, 또는 전해질 불균형 등도 다리의 욱신거림을 유발할 수 있습니다.

만약 이러한 증상이 처음 발생했거나 갑작스럽게 나타났다면, 단순한 피로나 일시적인 근육 긴장일 수 있습니다. 하지만 증상이 지속되거나 다른 증상들이 동반된다면, 의사의 진료를 받아 정확한 원인을 파악하고 적절한 치료를 받는 것이 중요합니다.

다리가 욱신거리는 증상이 지속되거나 심해진다면, 특히 다음과 같은 증상이 동반될 경우 즉시 의료 도움을 받으시기 바랍니다:
- 갑작스러운 심한 통증
- 붓기나 발적
- 체온 상승
- 감각 이상이나 마비 증상
- 걷기 어려움

집에서는 충분한 휴식을 취하고, 다리를 높이 올려 휴식을 취하는 것이 도움이 될 수 있습니다. 또한, 가벼운 스트레칭이나 마사지로 근육의 긴장을 풀어주는 것도 좋습니다. 하지만 이러한 자가 관리에도 불구하고 증상이 개선되지 않는다면 전문가의 진료를 받으시는 것이 좋습니다."
