,질문,소견
440,"아이 눈이 아침에일어났더니
팅팅부어있어서 안과갔더니
다래끼는 아직안보인다고
그렇지만 올라오는중일수있으니
항생제 안약과 알러지안약
먹는항생제주셨어요 그런데 오후쯤보니
이렇게 하얀좁쌀같은게 올라왔네요.
약먹으면 짜지않고도 가라앉을까요?","다래끼 초기 증상으로 항생제 안약과 경구 항생제를 처방받으셨군요. 하얀 쌀알 같은 것이 눈에 올라온 것은 다래끼가 형성되는 과정 중에 나타날 수 있는 증상일 수 있습니다. 항생제는 세균 감염에 의한 염증을 줄이는 데 도움을 줄 수 있으며, 알러지안약은 부기와 관련된 증상을 완화하는 데 도움을 줄 수 있습니다.

약을 꾸준히 복용하면서 증상의 변화를 관찰하시고, 지시받은 대로 정해진 기간 동안 약을 사용하시는 것이 중요합니다. 대부분의 경우, 적절한 치료를 받으면 다래끼는 저절로 가라앉을 수 있습니다. 하지만 증상이 호전되지 않거나 더 악화되는 경우에는 다시 안과 전문의와 상담하셔야 합니다.

또한, 아이의 눈을 만지지 않도록 주의하시고, 손을 자주 씻는 등 위생 관리에 신경 쓰시는 것이 중요합니다. 만약 아이가 눈을 비비거나 자극을 주는 행동을 한다면 증상이 더 악화될 수 있으니 주의가 필요합니다.

약물 치료와 함께 증상이 호전되기를 바라며, 만약 증상이 계속되거나 다른 이상 증상이 나타난다면 즉시 의료진의 도움을 받으시기 바랍니다."
441,"안압이 있을때 높은 배게 비면 눈이 충혈 되나요?
근시인데 2.25 디옵터 양쪽다 안경 쓰고나서 높은 배게 누우니 갑자기 눈에 압력 느낌 들면서 눈이 시뻘개집니다. 안경 쓰기전에는 안압도 없고 높게 벼도 눈 충혈은 안됬는데 왜 그런거죠?","높은 베개를 사용하실 때 안압이 영향을 받아 눈이 충혈될 수 있는지에 대한 질문이시군요. 일반적으로 높은 베개를 사용하는 것이 직접적으로 안압을 높이는 주된 원인은 아닙니다. 그러나 얼굴에 피가 쏠리는 자세를 하면 안압이 같이 높아 질수 있으며, 목이나 머리에 혈액 순환이 제대로 이루어지지 않을 경우 눈에 혈액이 몰려 충혈이 발생할 수 있습니다.

근시가 있는 경우에는 2.25 디옵터의 안경을 착용하면서 눈에 압력을 느끼고 충혈이 생긴다면, 안경 착용으로 인한 시력 교정이 눈의 피로도나 안구의 스트레스에 영향을 줄 수 있습니다. 안경을 새로 맞춘 후에는 눈이 새로운 굴절 상태에 적응하는 과정에서 일시적인 불편함이나 충혈이 발생할 수 있습니다.

그러나 안경 착용 전에는 문제가 없었고, 착용 후에 문제가 발생했다면, 안경의 처방이 적절한지, 안경테의 핏이나 무게가 눈에 부담을 주고 있는지 등을 확인해볼 필요가 있습니다. 또한, 눈의 충혈이 지속된다면 안과 전문의와 상담하여 정확한 원인을 파악하고 적절한 조치를 취하는 것이 중요합니다.

안압이 높아져서 눈이 충혈되는 경우는 녹내장과 같은 질환에서 볼 수 있는 증상이기도 합니다. 따라서 이러한 증상이 지속되거나 다른 불편함이 동반된다면 안과 전문의의 진료를 받아보시는 것이 좋겠습니다."
442,여성호르몬 검사를 했는데 그걸로 임신 여부도 알 수 있나요?,"여성호르몬 검사는 에스트로겐, 프로게스테론 등의 호르몬 수치를 측정하는 것으로, 이것만으로는 임신 여부를 확실히 알 수 없어요. 임신 여부를 확인하기 위해서는 '인간 융모성 성선자극호르몬(hCG)'의 수치를 측정하는 임신 테스트가 필요해요. hCG는 임신 초기에 태반에서 생성되는 호르몬으로, 임신 여부를 확인하는 데 가장 정확한 지표입니다.

임신 여부를 확인하고자 할 때는 소변이나 혈액을 이용한 임신 테스트를 사용하는 것이 좋아요. 소변을 이용한 임신 테스트는 약국에서 구입할 수 있는 임신테스트기를 사용하여 집에서 간편하게 확인할 수 있어요. 그리고, 생리 예정일 2주 후 또는 마지막 관계일로부터 2주 후에 임신테스트기를 권유드려요. 아침 첫뇨를 이용하시는 것이 가장 좋아요. 혈액 검사는 병원이나 클리닉에서 전문적인 검사를 통해 hCG 수치를 측정하여 임신 여부를 확인할 수 있어요. 혈액검사는 마지막 관계일로부터 8~10일 이상 지났을 때에 시행하시는 것이 좋아요. 다만, 진료비, 약제비는 개인의 상태와 더불어 병원마다 다를 수 있어 정확한 정보를 드리기는 어려운 점 양해부탁드려요."
443,쌍둥이로 태어난 사람이 쌍둥이를 낳을 확률은 얼마나 되나요?,"쌍둥이를 낳는 확률은 여러 요인에 의해 영향을 받는데, 유전적 요인도 그 중 하나입니다. 특히 이란성 쌍둥이가 일란성 쌍둥이보다 가족 내에서 더 자주 발생하는 경향이 있어요. 쌍둥이가 가족력에 있는 경우, 특히 어머니 쪽 가족에서 쌍둥이가 있었다면, 쌍둥이를 낳을 확률이 일반 인구보다 높아질 수 있습니다.

그러나 정확한 확률을 제시하기는 어렵습니다. 쌍둥이 출산 확률은 인종, 연령, 가족력, 그리고 임신 방법 등 다양한 요인에 따라 달라질 수 있어요. 예를 들어, 특정 불임 치료를 받는 경우 쌍둥이를 임신할 확률이 높아질 수 있습니다.

쌍둥이로 태어난 사람이 쌍둥이를 낳을 확률에 대한 구체적인 수치는 연구마다 다르게 보고되고 있으며, 이는 통계적으로 명확하게 정해진 것이 아니라 추정치에 가깝습니다. 따라서 쌍둥이 출산 확률에 대해 더 정확한 정보를 원한다면 유전학 전문가나 산부인과 전문의와 상담하는 것이 좋습니다. * 반복된 질문이나 동일한 질문은 삭제처리 될 수 있음을 안내드립니다."
444,몸이 휘청거리고 몸에서 뚝소리가 자주나요 뚝소리 나고 나면 뻐근한 느낌,"몸이 휘청거리고 몸에서 '뚝' 소리가 나며 뻐근함을 느끼는 증상은 다양한 원인에 의해 발생할 수 있습니다. 몸에서 '뚝'하고 나는 소리는 관절열극에서 난다고 하는데요. 관절의 윤활제 같은 역할을 하는 활액이 채워져있는데 , 움직이면서 순간적으로 기포가 빠져나가면서 소리가 나는 것으로 추정됩니다. 하지만 휘청거림이 동반되고 뻐근한 느낌이 지속된다면, 근골격계 문제, 전정기관의 이상, 신경계 문제 등을 의심해볼 수 있습니다.

이러한 증상이 지속되거나 심해진다면 전문의와 상담을 통해 정확한 진단을 받는 것이 중요합니다. 특히 휘청거림이 심하거나 일상생활에 지장을 준다면, 신속히 의료 기관을 방문하여 상담을 받으시기 바랍니다. 정확한 진단을 위해 신체 검사, 혈액 검사, 영상 진단 등이 필요할 수 있습니다."
445,불안이 오면 참지말고 조금씩은 약을 복용하란 말씀이저? 그리고 약을 줄인 이후에 가끔씩 이유없이 소름이 끼치는데 괜찮은건가요?,"불안 증상으로 약물을 복용하시는 경우, 약물의 부작용이나 금단 증상으로 인해 소름이 끼치는 등의 신체적 반응이 나타날 수 있어요. 불안 증상이 있을 때 약을 복용하시고 도움을 받으시는 게 좋을 것 같아요. 의사는 환자의 상태를 고려하여 적절한 용량과 복용 방법을 처방하니, 그 지시에 따라야 합니다.

약물을 줄인 이후에 가끔씩 이유 없이 소름이 끼치는 현상은 금단 증상이나 약물의 부작용, 또는 불안 증상 자체일 수도 있어요. 이러한 증상이 지속되거나 걱정이 된다면, 복용하고 있는 약물의 종류와 용량, 그리고 증상에 대해 담당 의사와 상의하는 것이 중요해요. 의사는 증상의 원인을 파악하고 필요한 조치를 취할 수 있습니다.

약물 복용과 관련된 증상이나 변화는 개인마다 다를 수 있으므로, 전문가의 조언을 구하는 것이 가장 안전해요. 자가 진단이나 자가 치료보다는 의료 전문가의 지시를 따르는 것이 중요합니다."
446,"3월14일에서~3월 21일 까지
일동 세파클러 수화물 약을 복용했고
3월 22일부터~ 3월 28일까지 후라시닐을 복용했습니다.
STD12종 검사를 언제 하는게 좋을까요?","항생제인 세파클러와 후라시닐을 복용하신 후에 STD 12종 검사를 받으실 때는 항생제가 몸에서 완전히 제거된 후에 검사를 받는 것이 좋습니다. 항생제는 일부 성병의 원인균에 영향을 줄 수 있으므로, 항생제 복용이 검사 결과에 영향을 줄 수 있습니다.

세파클러를 마지막으로 복용한 날이 3월 21일이고, 후라시닐을 3월 28일까지 복용하셨다면, 대략적으로 항생제가 몸에서 제거되는 데 필요한 시간을 고려하여 최소 1주일 후에 검사를 받으시는 것이 좋습니다. 그러므로 4월 4일 이후에 STD 12종 검사를 받으시는 것을 추천드립니다.

그러나 정확한 시기는 사용하신 항생제의 반감기와 개인의 대사 속도에 따라 달라질 수 있으므로, 가장 정확한 정보는 담당 의사나 검사를 진행할 의료 기관에 문의하시는 것이 가장 좋습니다. 그리고 검사 시기는 산부인과 선생님과 상의 후 결정하시는 것을 권유 드려요."
447,"언제부터 그랬는지 모르겠지만, 어느 날 부터
오른 쪽 관자놀이 부근인지 어느 부분인지 정확히는 모르겠습니다.. 오른쪽 머리가 아프면서 뒷 머리도 땡기듯이 종종 아프더라구요 자고 일어나도 오른쪽 머리 두통이 있다가 사라지는 왜 그러는 걸까요? 두통 외엔 별다른 건 없습니다.","오른쪽 관자놀이 부근의 두통은 어깨의 근육긴장, 침샘 비대증, 거북 목, 일자 목, 수면 중 이갈이 등으로 발생할 수 있어요. 또한, 잘못된 자세나 스트레스, 수면 부족 등도 두통을 유발할 수 있습니다.

자고 일어났을 때도 두통이 있다가 사라지는 것은 수면 중의 자세나 수면의 질이 영향을 미칠 수 있습니다. 예를 들어, 베개의 높이가 너무 높거나 낮아서 목이나 머리에 부담을 주는 경우, 또는 수면 중에 이갈이를 하는 경우 등이 있습니다.

두통이 지속되거나 심해진다면, 정확한 진단과 적절한 치료를 위해 의사의 진료를 받는 것이 좋습니다. 특히 두통 외에 다른 증상이 없다고 하더라도, 두통이 반복되거나 갑자기 심해지는 경우에는 더욱 그렇습니다.

가까운 시일 내에 병원을 방문하여 정밀 검사를 받아보시는 것을 권장합니다. 의사는 두통의 원인을 파악하기 위해 병력 청취, 신체 검사, 필요에 따라 영상 검사나 다른 검사들을 시행할 수 있습니다. 그 결과에 따라 적절한 치료 방법을 제안할 것입니다."
448,허리 통증이 있는데 동네 약국에서 증상을 듣더니 신장이 좋지 않아 허리통증이 있는거같다라고 말해주었습니다. 이럴때는 어떻게 해야하는지 어느과 진료를 봐야하는지 비대면 진료 처방이 가능한지 궁금합니다,"허리 통증이 신장 문제와 관련이 있다고 의심될 때는 정확한 진단을 받기 위해 병원을 방문하는 것이 중요합니다. 신장 문제를 포함하여 허리 통증의 원인은 다양할 수 있으므로, 전문의의 진찰을 받아보시는 것이 좋습니다.

1. 비뇨기과 또는 내과: 신장 문제를 의심할 때는 비뇨기과나 내과에서 진료를 받을 수 있습니다. 의사는 증상을 듣고 필요한 경우 혈액 검사, 소변 검사, 영상 진단(예: 초음파, CT) 등을 통해 신장의 상태를 평가할 수 있습니다.

2. 정형외과, 통증의학과, 신경외과: 허리 통증이 근골격계 문제로 인한 것일 수도 있으므로 이들 진료과를 고려할 수 있습니다. 허리디스크로 인한 통증은 소염진통제를 복용하실 수 있으나, 일반의약품으로 해소되지 않는 통증은 전문의약품의 복용이 필요해요.

비대면 진료 처방의 경우, 현재 거주하시는 지역과 해당 지역의 의료 정책에 따라 가능 여부가 달라질 수 있습니다. 단, 2023년 6월 1일부터 감염병 위기단계가 하향됨에 따라 제한적 비대면진료가 시행되며, 8월 31일까지 계도 기간으로 이 기간 중에는 시범사업 규정과 현행 비대면진료가 혼재되어 진행될 수 있습니다. 제한적 비대면 진료를 실시하는 병원에서는 대상환자 기준에 부합하는 경우에만 비대면진료가 가능하며, 대상환자 기준 확인은 보건복지부 공식블로그 또는 닥터나우 앱 내 '내 정보' > '서비스 문의' 를 통해 고객센터에서 확인해 주세요.

가까운 병원이나 의료기관에 문의하여 비대면 진료의 가능 여부를 확인하시고, 필요한 경우 예약을 통해 직접 방문하셔서 정확한 진단과 치료를 받으시길 권장드립니다."
449,살을 일주일 안에 10kg을 빼고 싶은데 어떻게 하면 좋을까요,"일주일 안에 10kg을 감량하는 것은 매우 비현실적이며 건강에 매우 위험할 수 있습니다. 안전하고 건강한 체중 감량 속도는 주로 주당 0.5kg에서 1kg 정도입니다. 급격한 체중 감량은 영양 결핍, 근육 손실, 탈수, 그리고 장기적으로는 대사 속도 저하와 같은 부작용을 초래할 수 있습니다.

체중을 감량하고자 한다면, 균형 잡힌 식단과 꾸준한 운동을 병행하는 것이 중요합니다. 식사는 과일, 채소, 통곡물, 단백질이 풍부한 식품을 섭취하고, 가공식품과 설탕, 지방이 많은 음식은 피하는 것이 좋습니다. 또한, 규칙적인 유산소 운동과 근력 운동을 병행하여 칼로리 소모를 증가시키고 근육량을 유지하는 것이 도움이 됩니다.

단기간에 체중을 감량하려는 시도는 건강을 해칠 수 있으므로, 장기적인 관점에서 체중 관리 계획을 세우는 것이 중요합니다. 필요하다면 영양사나 의사와 상담하여 개인에 맞는 건강한 체중 감량 계획을 수립하는 것을 추천드립니다."
450,"최근 무릎에 뭔가 신경이 쭉 쏠려있습니다
특히 잘려고 누워서 눈을 감으면 왼쪽 무릎부터 발목까지 모든 신경이 거기로 집중대서 잠을 설쳐요 아프다는 아니고 저리다? 정확히 뭐라고 말을 해야할지 모르겠는 느낌입니다
+잠을 설치면서 느낀게 오른쪽 왼쪽 제몸 높낮이가 매우 다른거 같아요
정형외과를 가야할까요?","무릎에서 발목까지 신경이 집중되는 느낌과 저림 증상, 그리고 몸의 높낮이 차이를 느끼는 것은 정형외과 전문의의 진료가 필요할 수 있는 증상으로 보여요. 특히 증상이 수면에 영향을 주고 있으니, 더 이상 지체하지 말고 가까운 정형외과에 내원하여 정확한 진단을 받는 것이 중요해요. 의사는 적절한 검사와 진찰을 통해 문제의 원인을 파악하고 적절한 치료 방안을 세울 것으로 보여요."
452,주기는 34일 생리 예정일로부터 5일 밀렸는데 오늘 성관계를 가졌어요 생리 예정일로부터 5일이나 지났는데 임신 가능성이 큰가요?,"생리 예정일로부터 5일이 지난 상태에서의 임신 가능성은 여성의 생리주기와 개인의 상태에 따라 달라질 수 있어요. 일반적으로 여성의 배란일은 생리주기의 중간 즈음으로, 34일 주기라면 대략 17일경에 배란이 일어날 것으로 추정되지만, 개인마다 배란일이 다르고, 스트레스나 호르몬 변화 등으로 인해 배란이 늦어지거나 일찍 일어날 수 있어요.

생리 예정일이 지나고 5일이 지났다면, 배란일로부터 시간이 꽤 지난 상태이기 때문에 임신 가능성은 상대적으로 낮을 수 있지만, 어떠한 상황에서도 임신 가능성이 0% 라고 확신하기는 어려워요. 만약 임신을 원하지 않는다면, 성관계 후 72시간 이내에 복용하는 사후피임약을 고려할 수 있습니다. 사후피임약은 처방전이 필요하므로 가까운 병원이나 산부인과를 방문하여 상담을 받으시는 것이 좋습니다. 그리고 임신을 하면 안 되는 상황이라면 반드시 콘돔 등 적절한 피임 기구를 사용하실 것을 권장드려요."
453,"아이가 오늘 수액맞은후 팔이 많이부었는데 냉찜질 해주면될까요? 수액맞을때 테이프를 여러번 감아서 쎄게붙여놨었습니다
병원에서는 1~2일 지켜보라는데 그래도안빠지면 병원다시 내방해야되나요? 냉찜질해되되나요?","수액을 맞은 후 팔이 붓는 경우는 주사 부위에 염증이 생기거나, 주사액이 정맥을 벗어나 주변 조직으로 유출되었을 때 발생할 수 있어요. 이럴 때 냉찜질은 붓기와 염증을 줄이는 데 도움이 될 수 있어요. 냉찜질을 할 때는 얼음팩이나 냉찜질 팩을 수건이나 천으로 감싸서 직접 피부에 닿지 않도록 하고, 15-20분 정도 부위에 대고, 그 후에는 피부가 회복될 수 있도록 20분 정도 쉬어주는 것이 좋아요. 이를 하루에 여러 번 반복할 수 있어요.

병원에서 말씀하신 대로 1~2일 동안 지켜보시되, 붓기가 줄어들지 않거나, 통증, 발적, 열감 등의 증상이 심해지거나 지속된다면 즉시 병원에 다시 방문하여 의사의 진료를 받으시는 것이 좋아요. 붓기가 줄어들지 않거나 다른 증상이 동반되는 경우, 추가적인 치료가 필요할 수 있기 때문이에요."
454,"출산 80일차입니다(제왕절개, 완분중)
며칠전부터 머리가아프더니 오늘은 얼굴부터 발끝까지 노랗게 황달인거같은데 출산후에 산모가 이럴수도있나요? 생리는 어제 시작했고 지금 목감기가걸려서 오늘부터 약 복용중입니다","출산 후 80일이 지난 시점에서 황달 증상을 경험하는 것은 일반적인 상황은 아닙니다. 황달은 피부와 눈의 흰 부분이 노랗게 변하는 것을 말하며, 이는 주로 간 기능 장애, 담도 문제, 혹은 빌리루빈 수치가 높아질 때 발생합니다.

산후 황달이 발생할 수 있는 몇 가지 가능한 원인으로는 간염, 담석, 빌리루빈 수치 증가 등이 있으나, 이는 드문 경우이며, 정확한 진단을 위해서는 의사의 진찰이 필요합니다. 특히 출산 후 몸이 회복 중인 상태에서 감염이나 다른 건강 문제가 발생할 수 있으므로, 증상을 가볍게 여기지 말고 즉시 의료 기관을 방문하여 정확한 진단과 적절한 치료를 받으시는 것이 중요합니다.

생리가 시작되었고 목감기로 인해 약을 복용 중이시라면, 약물 반응으로 인한 증상일 수도 있지만, 이는 황달의 원인이 될 수 없습니다. 따라서, 빠른 시간 내에 병원을 방문하여 전문의와 상담하시길 권장드립니다. 의사는 증상을 평가하고 필요한 검사를 진행하여 적절한 치료 방향을 제시할 것입니다."
455,결막염이 생겼는데 약국 결막염용 안약을 넣어도 증상이 심해집니다. 알레르기성인지 유행성인지 모르겠습니다. 따로 항생제를 사용해야하나요?,"결막염의 증상이 악화되고 있다면, 정확한 진단을 위해 안과 전문의의 진료를 받는 것이 중요합니다. 알레르기성 결막염과 유행성 결막염은 증상이 비슷할 수 있지만, 원인과 치료 방법이 다릅니다.

알레르기성 결막염은 주로 환경적 알레르겐에 의해 발생하며, 가려움증, 충혈, 눈물 흘림 등의 증상이 나타납니다. 이 경우 항히스타민제나 스테로이드가 포함된 안약을 사용할 수 있습니다. 루체피점안액 같은 알레르기용결막염치료제를 사용해볼 수 있어요.

반면, 유행성 결막염은 바이러스에 의해 발생하며, 눈의 충혈, 분비물 증가, 눈꺼풀 부기 등의 증상이 나타날 수 있습니다. 바이러스성 결막염의 경우 항생제는 효과가 없으며, 대부분의 경우 자연 치유를 기다리는 대증 치료를 합니다.

항생제는 세균성 결막염에만 효과가 있으며, 세균성 결막염은 눈에서 끈적끈적한 분비물이 나오는 것이 특징입니다. 항생제 안약이 필요한지 여부는 의사의 진단에 따라 결정됩니다. 일반적으로는 경구용 항생제를 잘 복용하지 않고, 항생제 성분의 안약을 사용하고 인공눈물 등을 충분히 사용하면서 관찰하게 돼요.

약국에서 구입한 결막염용 안약이 증상을 완화시키지 못한다면, 안과 전문의에게 진료를 받아 정확한 원인을 파악하고 적절한 치료를 받는 것이 좋습니다. 자가 진단이나 자가 치료보다는 전문가의 조언을 따르는 것이 안전합니다."
456,남시선을 느낄때마다 얼굴과 귀가 빨개지고 심할때는 두피열도 생기고 두통도 있는데 어떻게 해결하는게 좋을까요? 이것때문에 탈모나 다른문제가 생길 수 있나요?,"남시선을 느낄 때 얼굴과 귀가 빨개지는 것은 자율신경계의 반응으로 인한 현상이며, 이는 호르몬의 변화, 주사(rosacea), 부신종양 등의 원인이 있을 수 있어요. 두통이 동반된다면, 스트레스, 피로, 수면부족 등의 원인이 있는 상태에서 발생한 가벼운 두통일 수 있어요. 이런 경우, 일반적으로 처방전 없이 약국에서 살 수 있는 진통제로도 어느 정도 증상 조절이 가능하며, 스트레스 등의 원인 요소가 사라지면 두통도 함께 사라지는 편입니다.

다만, 이러한 증상이 일상생활에 큰 불편을 주거나 지속적으로 나타난다면, 전문의와 상담을 통해 적절한 진단과 치료를 받는 것이 좋습니다. 스트레스 관리나 심리적인 지원이 필요할 수도 있으며, 경우에 따라서는 약물 치료가 필요할 수도 있습니다. 

또한, 남시선으로 인한 얼굴의 발적이나 두통이 탈모를 직접적으로 유발한다고 보기는 어렵습니다. 그러나 만약 스트레스가 지속되어 신체적, 정신적 건강에 영향을 미친다면, 간접적으로 탈모나 다른 건강 문제를 유발할 수 있습니다. 이런 경우에는 정신건강의학과에서 진료를 받아보시는 것이 좋을 것 같아요."
457,사후피임약 처방받고싶어요,"사후피임약을 처방받으려면 의사의 진료를 받아야 합니다. 앱내 과목진료 > 산부인과에서 의사를 선택하시어 진료신청하시면 됩니다. 의사는 여러분의 건강 상태와 사후피임약 복용이 적합한지를 판단한 후 처방전을 작성해 줄 것입니다. 사후 피임약의 경우 가능한 빨리, 성교 후 최대 72시간 내에 복용해야 가장 좋은 효과를 볼 수 있으며 24시간 내에 복용하는 것이 95% 확률로 피임이 가능하다고 알려져 있어요. 하지만 사후 피임약은 일반 피임약에 비하여 호르몬 함량이 약 10배 이상 높은 정도로 체내 호르몬 농도를 인위적으로 증가시켜 착상을 방해하기 때문에 생리 주기를 바꾸기도 하고 부정 출혈, 배란 장애가 생길 수 있어 반드시 의사 상담을 통해 처방을 받아야해요. 따라서 성관계 후 바로 진료신청을 하시는 것이 좋습니다."
458,귀안에 피가 고인건지 모르겠는데 갈색이 있어요. 뭔가요?,"귀 안에 갈색 분비물이 있다면 다양한 원인이 있을 수 있어요. 가장 흔한 경우는 외이도에 있는 귀지가 갈색을 띠는 것입니다. 귀지는 귀를 보호하는 역할을 하며, 자연스럽게 생성되고 배출되는 것이 정상이에요. 하지만 갈색 분비물이 갑자기 많아지거나, 불쾌한 냄새, 귀의 통증, 청력 저하 등 다른 증상이 동반된다면 외이도염, 중이염, 귀의 외상, 곰팡이 감염 등 다른 질환의 가능성도 고려해야 합니다.

이런 경우, 정확한 진단을 위해서는 이비인후과 전문의의 진료를 받는 것이 중요해요. 전문의는 귀를 직접 검사하여 정확한 원인을 파악하고 적절한 치료를 제공할 수 있습니다. 집에서 스스로 귀를 파거나 이물질을 제거하려고 시도하지 마시고, 전문가의 도움을 받으시기 바랍니다."
